{
  "schema": "sley.change.plan.v0",
  "status": "planned",
  "transaction": {
    "transaction_id": "sha256:0000000000000000000000000000000000000000000000000000000000000001",
    "state": "planned",
    "history": ["opened", "inspected", "planned"],
    "repository": {
      "root": ".",
      "identity_digest": "sha256:0000000000000000000000000000000000000000000000000000000000000002"
    },
    "base": {
      "mode": "working_tree",
      "commit": "0000000000000000000000000000000000000003",
      "source_digest": "sha256:0000000000000000000000000000000000000000000000000000000000000004",
      "graph_digest": "sha256:0000000000000000000000000000000000000000000000000000000000000005",
      "trace_digest": "sha256:0000000000000000000000000000000000000000000000000000000000000006"
    },
    "compiler": {
      "version": "sley 1.1",
      "contract_versions": {
        "diagnostics": "sley.diagnostics.report.v1",
        "graph_slice": "sley.symbol_graph.slice.v1",
        "verify": "sley.verify.report.v1",
        "inspection": "sley.transaction.inspect.v0",
        "plan": "sley.change.plan.v0"
      }
    },
    "actor": "operator:test",
    "goal": "preview a rename",
    "nonce": "fixture-plan-001",
    "created_at": "2026-08-25T00:00:00Z",
    "expires_at": "2099-01-01T00:00:00Z"
  },
  "inspection": {
    "schema": "sley.transaction.inspect.v0",
    "transaction_id": "sha256:0000000000000000000000000000000000000000000000000000000000000001",
    "context_digest": "sha256:0000000000000000000000000000000000000000000000000000000000000007",
    "target": "examples/project"
  },
  "plan": {
    "plan_digest": "sha256:0000000000000000000000000000000000000000000000000000000000000008",
    "operation_digest": "sha256:0000000000000000000000000000000000000000000000000000000000000009",
    "requested_outcome": "rename the exported task",
    "assumptions": ["the task exists"],
    "preconditions": ["the inspected base remains current"],
    "affected_nodes": ["task:app.math.double"],
    "affected_files": ["examples/project/src/app/math.sley"],
    "operations": [
      {
        "op": "RenameDeclaration",
        "target": "task:app.math.double",
        "payload": {"name": "scale"}
      }
    ],
    "expected_changes": {
      "call_sites": [],
      "types": [{"source": "compiler_derived", "description": "task identity changes"}],
      "effects": [],
      "authority": []
    },
    "validation_profile": {
      "id": "compiler_preview_v0",
      "required_checks": ["check", "lint", "graph_diff"]
    },
    "selected_tests": ["compiler_check", "compiler_lint", "structural_graph_diff"],
    "non_goals": ["do not write repository source"],
    "fact_sources": {
      "compiler": ["transaction inspection"],
      "operator": ["requested outcome"],
      "model": []
    }
  },
  "mutations": {
    "repository_source": false,
    "git_index": false,
    "trace_sidecars": false,
    "external_systems": false,
    "provider_state": false
  },
  "next_actions": [
    {
      "kind": "preview_candidate",
      "reason": "materialize only in an ephemeral copy",
      "command": ["sley", "change", "preview"]
    }
  ],
  "issues": []
}
